06:35:47.278555 Ethernet64 Out IP (tos 0xc0, ttl 1, id 33032, offset 0, flags [DF], proto TCP (6), length 71)
    10.0.0.32.bgp > 10.0.0.33.37011: Flags [P.], cksum 0xd69c (correct), seq 3340926533:3340926552, ack 42317541, win 124, options [nop,nop,TS val 2248376339 ecr 2592495231], length 19: BGP
	Keepalive Message (4), length: 19
06:35:47.278676 eth17 Out IP (tos 0xc0, ttl 1, id 33032, offset 0, flags [DF], proto TCP (6), length 71)
    10.0.0.32.bgp > 10.0.0.33.37011: Flags [P.], cksum 0xd69c (correct), seq 0:19, ack 1, win 124, options [nop,nop,TS val 2248376339 ecr 2592495231], length 19: BGP
	Keepalive Message (4), length: 19
06:35:47.279094 eth17 P   IP (tos 0xc0, ttl 1, id 30643, offset 0, flags [DF], proto TCP (6), length 52)
    10.0.0.33.37011 > 10.0.0.32.bgp: Flags [.], cksum 0xd615 (correct), seq 1, ack 19, win 6, options [nop,nop,TS val 2592496535 ecr 2248376339], length 0
06:35:47.279279 Ethernet64 In  IP (tos 0xc0, ttl 1, id 30643, offset 0, flags [DF], proto TCP (6), length 52)
    10.0.0.33.37011 > 10.0.0.32.bgp: Flags [.], cksum 0xd615 (correct), seq 1, ack 19, win 6, options [nop,nop,TS val 2592496535 ecr 2248376339], length 0
06:35:48.975707 eth17 P   IP (tos 0xc0, ttl 1, id 30644, offset 0, flags [DF], proto TCP (6), length 71)
    10.0.0.33.37011 > 10.0.0.32.bgp: Flags [P.], cksum 0xcb47 (correct), seq 1:20, ack 19, win 6, options [nop,nop,TS val 2592498231 ecr 2248376339], length 19: BGP
	Keepalive Message (4), length: 19
06:35:48.976865 Ethernet64 In  IP (tos 0xc0, ttl 1, id 30644, offset 0, flags [DF], proto TCP (6), length 71)
    10.0.0.33.37011 > 10.0.0.32.bgp: Flags [P.], cksum 0xcb47 (correct), seq 1:20, ack 19, win 6, options [nop,nop,TS val 2592498231 ecr 2248376339], length 19: BGP
	Keepalive Message (4), length: 19
06:35:48.976950 Ethernet64 Out IP (tos 0xc0, ttl 1, id 33033, offset 0, flags [DF], proto TCP (6), length 52)
    10.0.0.32.bgp > 10.0.0.33.37011: Flags [.], cksum 0xc849 (correct), seq 19, ack 20, win 124, options [nop,nop,TS val 2248378038 ecr 2592498231], length 0
06:35:48.977126 eth17 Out IP (tos 0xc0, ttl 1, id 33033, offset 0, flags [DF], proto TCP (6), length 52)
    10.0.0.32.bgp > 10.0.0.33.37011: Flags [.], cksum 0xc849 (correct), seq 19, ack 20, win 124, options [nop,nop,TS val 2248378038 ecr 2592498231], length 0
06:35:50.278503 Ethernet64 Out IP (tos 0xc0, ttl 1, id 33034, offset 0, flags [DF], proto TCP (6), length 71)
    10.0.0.32.bgp > 10.0.0.33.37011: Flags [P.], cksum 0xbf06 (correct), seq 19:38, ack 20, win 124, options [nop,nop,TS val 2248379339 ecr 2592498231], length 19: BGP
	Keepalive Message (4), length: 19
06:35:50.278665 eth17 Out IP (tos 0xc0, ttl 1, id 33034, offset 0, flags [DF], proto TCP (6), length 71)
    10.0.0.32.bgp > 10.0.0.33.37011: Flags [P.], cksum 0xbf06 (correct), seq 19:38, ack 20, win 124, options [nop,nop,TS val 2248379339 ecr 2592498231], length 19: BGP
	Keepalive Message (4), length: 19
06:35:50.279685 eth17 P   IP (tos 0xc0, ttl 1, id 30645, offset 0, flags [DF], proto TCP (6), length 52)
    10.0.0.33.37011 > 10.0.0.32.bgp: Flags [.], cksum 0xbe7f (correct), seq 20, ack 38, win 6, options [nop,nop,TS val 2592499535 ecr 2248379339], length 0
06:35:50.280572 Ethernet64 In  IP (tos 0xc0, ttl 1, id 30645, offset 0, flags [DF], proto TCP (6), length 52)
    10.0.0.33.37011 > 10.0.0.32.bgp: Flags [.], cksum 0xbe7f (correct), seq 20, ack 38, win 6, options [nop,nop,TS val 2592499535 ecr 2248379339], length 0
06:35:51.975374 eth17 P   IP (tos 0xc0, ttl 1, id 30646, offset 0, flags [DF], proto TCP (6), length 71)
    10.0.0.33.37011 > 10.0.0.32.bgp: Flags [P.], cksum 0xb3b1 (correct), seq 20:39, ack 38, win 6, options [nop,nop,TS val 2592501231 ecr 2248379339], length 19: BGP
	Keepalive Message (4), length: 19
06:35:51.975858 Ethernet64 In  IP (tos 0xc0, ttl 1, id 30646, offset 0, flags [DF], proto TCP (6), length 71)
    10.0.0.33.37011 > 10.0.0.32.bgp: Flags [P.], cksum 0xb3b1 (correct), seq 20:39, ack 38, win 6, options [nop,nop,TS val 2592501231 ecr 2248379339], length 19: BGP
	Keepalive Message (4), length: 19
06:35:51.975917 Ethernet64 Out IP (tos 0xc0, ttl 1, id 33035, offset 0, flags [DF], proto TCP (6), length 52)
    10.0.0.32.bgp > 10.0.0.33.37011: Flags [.], cksum 0xb0b4 (correct), seq 38, ack 39, win 124, options [nop,nop,TS val 2248381037 ecr 2592501231], length 0
06:35:51.976074 eth17 Out IP (tos 0xc0, ttl 1, id 33035, offset 0, flags [DF], proto TCP (6), length 52)
    10.0.0.32.bgp > 10.0.0.33.37011: Flags [.], cksum 0xb0b4 (correct), seq 38, ack 39, win 124, options [nop,nop,TS val 2248381037 ecr 2592501231], length 0
06:35:53.278012 Ethernet64 Out IP (tos 0xc0, ttl 1, id 33036, offset 0, flags [DF], proto TCP (6), length 71)
    10.0.0.32.bgp > 10.0.0.33.37011: Flags [P.], cksum 0xa770 (correct), seq 38:57, ack 39, win 124, options [nop,nop,TS val 2248382339 ecr 2592501231], length 19: BGP
	Keepalive Message (4), length: 19
06:35:53.278099 eth17 Out IP (tos 0xc0, ttl 1, id 33036, offset 0, flags [DF], proto TCP (6), length 71)
    10.0.0.32.bgp > 10.0.0.33.37011: Flags [P.], cksum 0xa770 (correct), seq 38:57, ack 39, win 124, options [nop,nop,TS val 2248382339 ecr 2592501231], length 19: BGP
	Keepalive Message (4), length: 19
06:35:53.278587 eth17 P   IP (tos 0xc0, ttl 1, id 30647, offset 0, flags [DF], proto TCP (6), length 52)
    10.0.0.33.37011 > 10.0.0.32.bgp: Flags [.], cksum 0xa6ea (correct), seq 39, ack 57, win 6, options [nop,nop,TS val 2592502534 ecr 2248382339], length 0
06:35:53.278743 Ethernet64 In  IP (tos 0xc0, ttl 1, id 30647, offset 0, flags [DF], proto TCP (6), length 52)
    10.0.0.33.37011 > 10.0.0.32.bgp: Flags [.], cksum 0xa6ea (correct), seq 39, ack 57, win 6, options [nop,nop,TS val 2592502534 ecr 2248382339], length 0
06:35:54.975380 eth17 P   IP (tos 0xc0, ttl 1, id 30648, offset 0, flags [DF], proto TCP (6), length 71)
    10.0.0.33.37011 > 10.0.0.32.bgp: Flags [P.], cksum 0x9c1b (correct), seq 39:58, ack 57, win 6, options [nop,nop,TS val 2592504231 ecr 2248382339], length 19: BGP
	Keepalive Message (4), length: 19
06:35:54.975815 Ethernet64 In  IP (tos 0xc0, ttl 1, id 30648, offset 0, flags [DF], proto TCP (6), length 71)
    10.0.0.33.37011 > 10.0.0.32.bgp: Flags [P.], cksum 0x9c1b (correct), seq 39:58, ack 57, win 6, options [nop,nop,TS val 2592504231 ecr 2248382339], length 19: BGP
	Keepalive Message (4), length: 19
06:35:54.975896 Ethernet64 Out IP (tos 0xc0, ttl 1, id 33037, offset 0, flags [DF], proto TCP (6), length 52)
    10.0.0.32.bgp > 10.0.0.33.37011: Flags [.], cksum 0x991e (correct), seq 57, ack 58, win 124, options [nop,nop,TS val 2248384037 ecr 2592504231], length 0
06:35:54.975995 eth17 Out IP (tos 0xc0, ttl 1, id 33037, offset 0, flags [DF], proto TCP (6), length 52)
    10.0.0.32.bgp > 10.0.0.33.37011: Flags [.], cksum 0x991e (correct), seq 57, ack 58, win 124, options [nop,nop,TS val 2248384037 ecr 2592504231], length 0
06:35:56.278023 Ethernet64 Out IP (tos 0xc0, ttl 1, id 33038, offset 0, flags [DF], proto TCP (6), length 71)
    10.0.0.32.bgp > 10.0.0.33.37011: Flags [P.], cksum 0x8fda (correct), seq 57:76, ack 58, win 124, options [nop,nop,TS val 2248385339 ecr 2592504231], length 19: BGP
	Keepalive Message (4), length: 19
06:35:56.278127 eth17 Out IP (tos 0xc0, ttl 1, id 33038, offset 0, flags [DF], proto TCP (6), length 71)
    10.0.0.32.bgp > 10.0.0.33.37011: Flags [P.], cksum 0x8fda (correct), seq 57:76, ack 58, win 124, options [nop,nop,TS val 2248385339 ecr 2592504231], length 19: BGP
	Keepalive Message (4), length: 19
06:35:56.279560 eth17 P   IP (tos 0xc0, ttl 1, id 30649, offset 0, flags [DF], proto TCP (6), length 52)
    10.0.0.33.37011 > 10.0.0.32.bgp: Flags [.], cksum 0x8f54 (correct), seq 58, ack 76, win 6, options [nop,nop,TS val 2592505534 ecr 2248385339], length 0
06:35:56.281012 Ethernet64 In  IP (tos 0xc0, ttl 1, id 30649, offset 0, flags [DF], proto TCP (6), length 52)
    10.0.0.33.37011 > 10.0.0.32.bgp: Flags [.], cksum 0x8f54 (correct), seq 58, ack 76, win 6, options [nop,nop,TS val 2592505534 ecr 2248385339], length 0
06:35:57.975411 eth17 P   IP (tos 0xc0, ttl 1, id 30650, offset 0, flags [DF], proto TCP (6), length 71)
    10.0.0.33.37011 > 10.0.0.32.bgp: Flags [P.], cksum 0x8485 (correct), seq 58:77, ack 76, win 6, options [nop,nop,TS val 2592507231 ecr 2248385339], length 19: BGP
	Keepalive Message (4), length: 19
06:35:57.975858 Ethernet64 In  IP (tos 0xc0, ttl 1, id 30650, offset 0, flags [DF], proto TCP (6), length 71)
    10.0.0.33.37011 > 10.0.0.32.bgp: Flags [P.], cksum 0x8485 (correct), seq 58:77, ack 76, win 6, options [nop,nop,TS val 2592507231 ecr 2248385339], length 19: BGP
	Keepalive Message (4), length: 19
06:35:57.975943 Ethernet64 Out IP (tos 0xc0, ttl 1, id 33039, offset 0, flags [DF], proto TCP (6), length 52)
    10.0.0.32.bgp > 10.0.0.33.37011: Flags [.], cksum 0x8188 (correct), seq 76, ack 77, win 124, options [nop,nop,TS val 2248387037 ecr 2592507231], length 0
06:35:57.976050 eth17 Out IP (tos 0xc0, ttl 1, id 33039, offset 0, flags [DF], proto TCP (6), length 52)
    10.0.0.32.bgp > 10.0.0.33.37011: Flags [.], cksum 0x8188 (correct), seq 76, ack 77, win 124, options [nop,nop,TS val 2248387037 ecr 2592507231], length 0
06:35:59.277991 Ethernet64 Out IP (tos 0xc0, ttl 1, id 33040, offset 0, flags [DF], proto TCP (6), length 71)
    10.0.0.32.bgp > 10.0.0.33.37011: Flags [P.], cksum 0x7844 (correct), seq 76:95, ack 77, win 124, options [nop,nop,TS val 2248388339 ecr 2592507231], length 19: BGP
	Keepalive Message (4), length: 19
06:35:59.278087 eth17 Out IP (tos 0xc0, ttl 1, id 33040, offset 0, flags [DF], proto TCP (6), length 71)
    10.0.0.32.bgp > 10.0.0.33.37011: Flags [P.], cksum 0x7844 (correct), seq 76:95, ack 77, win 124, options [nop,nop,TS val 2248388339 ecr 2592507231], length 19: BGP
	Keepalive Message (4), length: 19
06:35:59.278532 eth17 P   IP (tos 0xc0, ttl 1, id 30651, offset 0, flags [DF], proto TCP (6), length 52)
    10.0.0.33.37011 > 10.0.0.32.bgp: Flags [.], cksum 0x77be (correct), seq 77, ack 95, win 6, options [nop,nop,TS val 2592508534 ecr 2248388339], length 0
06:35:59.278661 Ethernet64 In  IP (tos 0xc0, ttl 1, id 30651, offset 0, flags [DF], proto TCP (6), length 52)
    10.0.0.33.37011 > 10.0.0.32.bgp: Flags [.], cksum 0x77be (correct), seq 77, ack 95, win 6, options [nop,nop,TS val 2592508534 ecr 2248388339], length 0
06:36:00.975511 eth17 P   IP (tos 0xc0, ttl 1, id 30652, offset 0, flags [DF], proto TCP (6), length 71)
    10.0.0.33.37011 > 10.0.0.32.bgp: Flags [P.], cksum 0x6cef (correct), seq 77:96, ack 95, win 6, options [nop,nop,TS val 2592510231 ecr 2248388339], length 19: BGP
	Keepalive Message (4), length: 19
06:36:00.976102 Ethernet64 In  IP (tos 0xc0, ttl 1, id 30652, offset 0, flags [DF], proto TCP (6), length 71)
    10.0.0.33.37011 > 10.0.0.32.bgp: Flags [P.], cksum 0x6cef (correct), seq 77:96, ack 95, win 6, options [nop,nop,TS val 2592510231 ecr 2248388339], length 19: BGP
	Keepalive Message (4), length: 19
06:36:00.976190 Ethernet64 Out IP (tos 0xc0, ttl 1, id 33041, offset 0, flags [DF], proto TCP (6), length 52)
    10.0.0.32.bgp > 10.0.0.33.37011: Flags [.], cksum 0x69f2 (correct), seq 95, ack 96, win 124, options [nop,nop,TS val 2248390037 ecr 2592510231], length 0
06:36:00.976425 eth17 Out IP (tos 0xc0, ttl 1, id 33041, offset 0, flags [DF], proto TCP (6), length 52)
    10.0.0.32.bgp > 10.0.0.33.37011: Flags [.], cksum 0x69f2 (correct), seq 95, ack 96, win 124, options [nop,nop,TS val 2248390037 ecr 2592510231], length 0
06:36:02.282835 Ethernet64 Out IP (tos 0xc0, ttl 1, id 33042, offset 0, flags [DF], proto TCP (6), length 71)
    10.0.0.32.bgp > 10.0.0.33.37011: Flags [P.], cksum 0x60a9 (correct), seq 95:114, ack 96, win 124, options [nop,nop,TS val 2248391344 ecr 2592510231], length 19: BGP
	Keepalive Message (4), length: 19
06:36:02.282930 eth17 Out IP (tos 0xc0, ttl 1, id 33042, offset 0, flags [DF], proto TCP (6), length 71)
    10.0.0.32.bgp > 10.0.0.33.37011: Flags [P.], cksum 0x60a9 (correct), seq 95:114, ack 96, win 124, options [nop,nop,TS val 2248391344 ecr 2592510231], length 19: BGP
	Keepalive Message (4), length: 19
06:36:02.285065 eth17 P   IP (tos 0xc0, ttl 1, id 30653, offset 0, flags [DF], proto TCP (6), length 52)
    10.0.0.33.37011 > 10.0.0.32.bgp: Flags [.], cksum 0x601e (correct), seq 96, ack 114, win 6, options [nop,nop,TS val 2592511539 ecr 2248391344], length 0
06:36:02.285190 Ethernet64 In  IP (tos 0xc0, ttl 1, id 30653, offset 0, flags [DF], proto TCP (6), length 52)
    10.0.0.33.37011 > 10.0.0.32.bgp: Flags [.], cksum 0x601e (correct), seq 96, ack 114, win 6, options [nop,nop,TS val 2592511539 ecr 2248391344], length 0
06:36:03.975470 eth17 P   IP (tos 0xc0, ttl 1, id 30654, offset 0, flags [DF], proto TCP (6), length 71)
    10.0.0.33.37011 > 10.0.0.32.bgp: Flags [P.], cksum 0x5554 (correct), seq 96:115, ack 114, win 6, options [nop,nop,TS val 2592513231 ecr 2248391344], length 19: BGP
	Keepalive Message (4), length: 19
06:36:03.975654 Ethernet64 In  IP (tos 0xc0, ttl 1, id 30654, offset 0, flags [DF], proto TCP (6), length 71)
    10.0.0.33.37011 > 10.0.0.32.bgp: Flags [P.], cksum 0x5554 (correct), seq 96:115, ack 114, win 6, options [nop,nop,TS val 2592513231 ecr 2248391344], length 19: BGP
	Keepalive Message (4), length: 19
06:36:03.975785 Ethernet64 Out IP (tos 0xc0, ttl 1, id 33043, offset 0, flags [DF], proto TCP (6), length 52)
    10.0.0.32.bgp > 10.0.0.33.37011: Flags [.], cksum 0x525c (correct), seq 114, ack 115, win 124, options [nop,nop,TS val 2248393037 ecr 2592513231], length 0
06:36:03.975874 eth17 Out IP (tos 0xc0, ttl 1, id 33043, offset 0, flags [DF], proto TCP (6), length 52)
    10.0.0.32.bgp > 10.0.0.33.37011: Flags [.], cksum 0x525c (correct), seq 114, ack 115, win 124, options [nop,nop,TS val 2248393037 ecr 2592513231], length 0
06:36:05.282915 Ethernet64 Out IP (tos 0xc0, ttl 1, id 33044, offset 0, flags [DF], proto TCP (6), length 71)
    10.0.0.32.bgp > 10.0.0.33.37011: Flags [P.], cksum 0x4913 (correct), seq 114:133, ack 115, win 124, options [nop,nop,TS val 2248394344 ecr 2592513231], length 19: BGP
	Keepalive Message (4), length: 19
06:36:05.283022 eth17 Out IP (tos 0xc0, ttl 1, id 33044, offset 0, flags [DF], proto TCP (6), length 71)
    10.0.0.32.bgp > 10.0.0.33.37011: Flags [P.], cksum 0x4913 (correct), seq 114:133, ack 115, win 124, options [nop,nop,TS val 2248394344 ecr 2592513231], length 19: BGP
	Keepalive Message (4), length: 19
06:36:05.284443 eth17 P   IP (tos 0xc0, ttl 1, id 30655, offset 0, flags [DF], proto TCP (6), length 52)
    10.0.0.33.37011 > 10.0.0.32.bgp: Flags [.], cksum 0x4888 (correct), seq 115, ack 133, win 6, options [nop,nop,TS val 2592514539 ecr 2248394344], length 0
06:36:05.285923 Ethernet64 In  IP (tos 0xc0, ttl 1, id 30655, offset 0, flags [DF], proto TCP (6), length 52)
    10.0.0.33.37011 > 10.0.0.32.bgp: Flags [.], cksum 0x4888 (correct), seq 115, ack 133, win 6, options [nop,nop,TS val 2592514539 ecr 2248394344], length 0
06:36:06.976416 eth17 P   IP (tos 0xc0, ttl 1, id 30656, offset 0, flags [DF], proto TCP (6), length 71)
    10.0.0.33.37011 > 10.0.0.32.bgp: Flags [P.], cksum 0x3dbe (correct), seq 115:134, ack 133, win 6, options [nop,nop,TS val 2592516231 ecr 2248394344], length 19: BGP
	Keepalive Message (4), length: 19
06:36:06.977716 Ethernet64 In  IP (tos 0xc0, ttl 1, id 30656, offset 0, flags [DF], proto TCP (6), length 71)
    10.0.0.33.37011 > 10.0.0.32.bgp: Flags [P.], cksum 0x3dbe (correct), seq 115:134, ack 133, win 6, options [nop,nop,TS val 2592516231 ecr 2248394344], length 19: BGP
	Keepalive Message (4), length: 19
06:36:06.978407 Ethernet64 Out IP (tos 0xc0, ttl 1, id 33045, offset 0, flags [DF], proto TCP (6), length 52)
    10.0.0.32.bgp > 10.0.0.33.37011: Flags [.], cksum 0x3ac4 (correct), seq 133, ack 134, win 124, options [nop,nop,TS val 2248396039 ecr 2592516231], length 0
06:36:06.978754 eth17 Out IP (tos 0xc0, ttl 1, id 33045, offset 0, flags [DF], proto TCP (6), length 52)
    10.0.0.32.bgp > 10.0.0.33.37011: Flags [.], cksum 0x3ac4 (correct), seq 133, ack 134, win 124, options [nop,nop,TS val 2248396039 ecr 2592516231], length 0
06:36:08.283042 Ethernet64 Out IP (tos 0xc0, ttl 1, id 33046, offset 0, flags [DF], proto TCP (6), length 71)
    10.0.0.32.bgp > 10.0.0.33.37011: Flags [P.], cksum 0x317d (correct), seq 133:152, ack 134, win 124, options [nop,nop,TS val 2248397344 ecr 2592516231], length 19: BGP
	Keepalive Message (4), length: 19
06:36:08.283149 eth17 Out IP (tos 0xc0, ttl 1, id 33046, offset 0, flags [DF], proto TCP (6), length 71)
    10.0.0.32.bgp > 10.0.0.33.37011: Flags [P.], cksum 0x317d (correct), seq 133:152, ack 134, win 124, options [nop,nop,TS val 2248397344 ecr 2592516231], length 19: BGP
	Keepalive Message (4), length: 19
06:36:08.283576 eth17 P   IP (tos 0xc0, ttl 1, id 30657, offset 0, flags [DF], proto TCP (6), length 52)
    10.0.0.33.37011 > 10.0.0.32.bgp: Flags [.], cksum 0x30f2 (correct), seq 134, ack 152, win 6, options [nop,nop,TS val 2592517539 ecr 2248397344], length 0
06:36:08.283725 Ethernet64 In  IP (tos 0xc0, ttl 1, id 30657, offset 0, flags [DF], proto TCP (6), length 52)
    10.0.0.33.37011 > 10.0.0.32.bgp: Flags [.], cksum 0x30f2 (correct), seq 134, ack 152, win 6, options [nop,nop,TS val 2592517539 ecr 2248397344], length 0
06:36:09.975514 eth17 P   IP (tos 0xc0, ttl 1, id 30658, offset 0, flags [DF], proto TCP (6), length 71)
    10.0.0.33.37011 > 10.0.0.32.bgp: Flags [P.], cksum 0x2628 (correct), seq 134:153, ack 152, win 6, options [nop,nop,TS val 2592519231 ecr 2248397344], length 19: BGP
	Keepalive Message (4), length: 19
06:36:09.975917 Ethernet64 In  IP (tos 0xc0, ttl 1, id 30658, offset 0, flags [DF], proto TCP (6), length 71)
    10.0.0.33.37011 > 10.0.0.32.bgp: Flags [P.], cksum 0x2628 (correct), seq 134:153, ack 152, win 6, options [nop,nop,TS val 2592519231 ecr 2248397344], length 19: BGP
	Keepalive Message (4), length: 19
06:36:09.976523 Ethernet64 Out IP (tos 0xc0, ttl 1, id 33047, offset 0, flags [DF], proto TCP (6), length 52)
    10.0.0.32.bgp > 10.0.0.33.37011: Flags [.], cksum 0x2330 (correct), seq 152, ack 153, win 124, options [nop,nop,TS val 2248399037 ecr 2592519231], length 0
06:36:09.976871 eth17 Out IP (tos 0xc0, ttl 1, id 33047, offset 0, flags [DF], proto TCP (6), length 52)
    10.0.0.32.bgp > 10.0.0.33.37011: Flags [.], cksum 0x2330 (correct), seq 152, ack 153, win 124, options [nop,nop,TS val 2248399037 ecr 2592519231], length 0
06:36:11.283097 Ethernet64 Out IP (tos 0xc0, ttl 1, id 33048, offset 0, flags [DF], proto TCP (6), length 71)
    10.0.0.32.bgp > 10.0.0.33.37011: Flags [P.], cksum 0x19e7 (correct), seq 152:171, ack 153, win 124, options [nop,nop,TS val 2248400344 ecr 2592519231], length 19: BGP
	Keepalive Message (4), length: 19
06:36:11.283206 eth17 Out IP (tos 0xc0, ttl 1, id 33048, offset 0, flags [DF], proto TCP (6), length 71)
    10.0.0.32.bgp > 10.0.0.33.37011: Flags [P.], cksum 0x19e7 (correct), seq 152:171, ack 153, win 124, options [nop,nop,TS val 2248400344 ecr 2592519231], length 19: BGP
	Keepalive Message (4), length: 19
06:36:11.283691 eth17 P   IP (tos 0xc0, ttl 1, id 30659, offset 0, flags [DF], proto TCP (6), length 52)
    10.0.0.33.37011 > 10.0.0.32.bgp: Flags [.], cksum 0x195c (correct), seq 153, ack 171, win 6, options [nop,nop,TS val 2592520539 ecr 2248400344], length 0
06:36:11.285518 Ethernet64 In  IP (tos 0xc0, ttl 1, id 30659, offset 0, flags [DF], proto TCP (6), length 52)
    10.0.0.33.37011 > 10.0.0.32.bgp: Flags [.], cksum 0x195c (correct), seq 153, ack 171, win 6, options [nop,nop,TS val 2592520539 ecr 2248400344], length 0
06:36:12.975470 eth17 P   IP (tos 0xc0, ttl 1, id 30660, offset 0, flags [DF], proto TCP (6), length 71)
    10.0.0.33.37011 > 10.0.0.32.bgp: Flags [P.], cksum 0x0e92 (correct), seq 153:172, ack 171, win 6, options [nop,nop,TS val 2592522231 ecr 2248400344], length 19: BGP
	Keepalive Message (4), length: 19
06:36:12.975979 Ethernet64 In  IP (tos 0xc0, ttl 1, id 30660, offset 0, flags [DF], proto TCP (6), length 71)
    10.0.0.33.37011 > 10.0.0.32.bgp: Flags [P.], cksum 0x0e92 (correct), seq 153:172, ack 171, win 6, options [nop,nop,TS val 2592522231 ecr 2248400344], length 19: BGP
	Keepalive Message (4), length: 19
06:36:12.976056 Ethernet64 Out IP (tos 0xc0, ttl 1, id 33049, offset 0, flags [DF], proto TCP (6), length 52)
    10.0.0.32.bgp > 10.0.0.33.37011: Flags [.], cksum 0x0b9a (correct), seq 171, ack 172, win 124, options [nop,nop,TS val 2248402037 ecr 2592522231], length 0
06:36:12.976168 eth17 Out IP (tos 0xc0, ttl 1, id 33049, offset 0, flags [DF], proto TCP (6), length 52)
    10.0.0.32.bgp > 10.0.0.33.37011: Flags [.], cksum 0x0b9a (correct), seq 171, ack 172, win 124, options [nop,nop,TS val 2248402037 ecr 2592522231], length 0
06:36:14.283064 Ethernet64 Out IP (tos 0xc0, ttl 1, id 33050, offset 0, flags [DF], proto TCP (6), length 71)
    10.0.0.32.bgp > 10.0.0.33.37011: Flags [P.], cksum 0x0251 (correct), seq 171:190, ack 172, win 124, options [nop,nop,TS val 2248403344 ecr 2592522231], length 19: BGP
	Keepalive Message (4), length: 19
06:36:14.283172 eth17 Out IP (tos 0xc0, ttl 1, id 33050, offset 0, flags [DF], proto TCP (6), length 71)
    10.0.0.32.bgp > 10.0.0.33.37011: Flags [P.], cksum 0x0251 (correct), seq 171:190, ack 172, win 124, options [nop,nop,TS val 2248403344 ecr 2592522231], length 19: BGP
	Keepalive Message (4), length: 19
06:36:14.283630 eth17 P   IP (tos 0xc0, ttl 1, id 30661, offset 0, flags [DF], proto TCP (6), length 52)
    10.0.0.33.37011 > 10.0.0.32.bgp: Flags [.], cksum 0x01c6 (correct), seq 172, ack 190, win 6, options [nop,nop,TS val 2592523539 ecr 2248403344], length 0
06:36:14.283744 Ethernet64 In  IP (tos 0xc0, ttl 1, id 30661, offset 0, flags [DF], proto TCP (6), length 52)
    10.0.0.33.37011 > 10.0.0.32.bgp: Flags [.], cksum 0x01c6 (correct), seq 172, ack 190, win 6, options [nop,nop,TS val 2592523539 ecr 2248403344], length 0
06:36:15.975786 eth17 P   IP (tos 0xc0, ttl 1, id 30662, offset 0, flags [DF], proto TCP (6), length 71)
    10.0.0.33.37011 > 10.0.0.32.bgp: Flags [P.], cksum 0xf6fb (correct), seq 172:191, ack 190, win 6, options [nop,nop,TS val 2592525231 ecr 2248403344], length 19: BGP
	Keepalive Message (4), length: 19
06:36:15.976533 Ethernet64 In  IP (tos 0xc0, ttl 1, id 30662, offset 0, flags [DF], proto TCP (6), length 71)
    10.0.0.33.37011 > 10.0.0.32.bgp: Flags [P.], cksum 0xf6fb (correct), seq 172:191, ack 190, win 6, options [nop,nop,TS val 2592525231 ecr 2248403344], length 19: BGP
	Keepalive Message (4), length: 19
06:36:15.976726 Ethernet64 Out IP (tos 0xc0, ttl 1, id 33051, offset 0, flags [DF], proto TCP (6), length 52)
    10.0.0.32.bgp > 10.0.0.33.37011: Flags [.], cksum 0xf403 (correct), seq 190, ack 191, win 124, options [nop,nop,TS val 2248405037 ecr 2592525231], length 0
06:36:15.976976 eth17 Out IP (tos 0xc0, ttl 1, id 33051, offset 0, flags [DF], proto TCP (6), length 52)
    10.0.0.32.bgp > 10.0.0.33.37011: Flags [.], cksum 0xf403 (correct), seq 190, ack 191, win 124, options [nop,nop,TS val 2248405037 ecr 2592525231], length 0
06:36:17.282877 Ethernet64 Out IP (tos 0xc0, ttl 1, id 33052, offset 0, flags [DF], proto TCP (6), length 71)
    10.0.0.32.bgp > 10.0.0.33.37011: Flags [P.], cksum 0xeaba (correct), seq 190:209, ack 191, win 124, options [nop,nop,TS val 2248406344 ecr 2592525231], length 19: BGP
	Keepalive Message (4), length: 19
06:36:17.282996 eth17 Out IP (tos 0xc0, ttl 1, id 33052, offset 0, flags [DF], proto TCP (6), length 71)
    10.0.0.32.bgp > 10.0.0.33.37011: Flags [P.], cksum 0xeaba (correct), seq 190:209, ack 191, win 124, options [nop,nop,TS val 2248406344 ecr 2592525231], length 19: BGP
	Keepalive Message (4), length: 19
06:36:17.283473 eth17 P   IP (tos 0xc0, ttl 1, id 30663, offset 0, flags [DF], proto TCP (6), length 52)
    10.0.0.33.37011 > 10.0.0.32.bgp: Flags [.], cksum 0xea2f (correct), seq 191, ack 209, win 6, options [nop,nop,TS val 2592526539 ecr 2248406344], length 0
06:36:17.283698 Ethernet64 In  IP (tos 0xc0, ttl 1, id 30663, offset 0, flags [DF], proto TCP (6), length 52)
    10.0.0.33.37011 > 10.0.0.32.bgp: Flags [.], cksum 0xea2f (correct), seq 191, ack 209, win 6, options [nop,nop,TS val 2592526539 ecr 2248406344], length 0
06:36:18.975634 eth17 P   IP (tos 0xc0, ttl 1, id 30664, offset 0, flags [DF], proto TCP (6), length 71)
    10.0.0.33.37011 > 10.0.0.32.bgp: Flags [P.], cksum 0xdf65 (correct), seq 191:210, ack 209, win 6, options [nop,nop,TS val 2592528231 ecr 2248406344], length 19: BGP
	Keepalive Message (4), length: 19
06:36:18.976098 Ethernet64 In  IP (tos 0xc0, ttl 1, id 30664, offset 0, flags [DF], proto TCP (6), length 71)
    10.0.0.33.37011 > 10.0.0.32.bgp: Flags [P.], cksum 0xdf65 (correct), seq 191:210, ack 209, win 6, options [nop,nop,TS val 2592528231 ecr 2248406344], length 19: BGP
	Keepalive Message (4), length: 19
06:36:18.976187 Ethernet64 Out IP (tos 0xc0, ttl 1, id 33053, offset 0, flags [DF], proto TCP (6), length 52)
    10.0.0.32.bgp > 10.0.0.33.37011: Flags [.], cksum 0xdc6d (correct), seq 209, ack 210, win 124, options [nop,nop,TS val 2248408037 ecr 2592528231], length 0
06:36:18.976333 eth17 Out IP (tos 0xc0, ttl 1, id 33053, offset 0, flags [DF], proto TCP (6), length 52)
    10.0.0.32.bgp > 10.0.0.33.37011: Flags [.], cksum 0xdc6d (correct), seq 209, ack 210, win 124, options [nop,nop,TS val 2248408037 ecr 2592528231], length 0
06:36:20.283802 Ethernet64 Out IP (tos 0xc0, ttl 1, id 33054, offset 0, flags [DF], proto TCP (6), length 71)
    10.0.0.32.bgp > 10.0.0.33.37011: Flags [P.], cksum 0xd323 (correct), seq 209:228, ack 210, win 124, options [nop,nop,TS val 2248409345 ecr 2592528231], length 19: BGP
	Keepalive Message (4), length: 19
06:36:20.284110 eth17 Out IP (tos 0xc0, ttl 1, id 33054, offset 0, flags [DF], proto TCP (6), length 71)
    10.0.0.32.bgp > 10.0.0.33.37011: Flags [P.], cksum 0xd323 (correct), seq 209:228, ack 210, win 124, options [nop,nop,TS val 2248409345 ecr 2592528231], length 19: BGP
	Keepalive Message (4), length: 19
06:36:20.284797 eth17 P   IP (tos 0xc0, ttl 1, id 30665, offset 0, flags [DF], proto TCP (6), length 52)
    10.0.0.33.37011 > 10.0.0.32.bgp: Flags [.], cksum 0xd297 (correct), seq 210, ack 228, win 6, options [nop,nop,TS val 2592529540 ecr 2248409345], length 0
06:36:20.285177 Ethernet64 In  IP (tos 0xc0, ttl 1, id 30665, offset 0, flags [DF], proto TCP (6), length 52)
    10.0.0.33.37011 > 10.0.0.32.bgp: Flags [.], cksum 0xd297 (correct), seq 210, ack 228, win 6, options [nop,nop,TS val 2592529540 ecr 2248409345], length 0
06:36:21.975836 eth17 P   IP (tos 0xc0, ttl 1, id 30666, offset 0, flags [DF], proto TCP (6), length 71)
    10.0.0.33.37011 > 10.0.0.32.bgp: Flags [P.], cksum 0xc7ce (correct), seq 210:229, ack 228, win 6, options [nop,nop,TS val 2592531231 ecr 2248409345], length 19: BGP
	Keepalive Message (4), length: 19
06:36:21.976861 Ethernet64 In  IP (tos 0xc0, ttl 1, id 30666, offset 0, flags [DF], proto TCP (6), length 71)
    10.0.0.33.37011 > 10.0.0.32.bgp: Flags [P.], cksum 0xc7ce (correct), seq 210:229, ack 228, win 6, options [nop,nop,TS val 2592531231 ecr 2248409345], length 19: BGP
	Keepalive Message (4), length: 19
06:36:21.976938 Ethernet64 Out IP (tos 0xc0, ttl 1, id 33055, offset 0, flags [DF], proto TCP (6), length 52)
    10.0.0.32.bgp > 10.0.0.33.37011: Flags [.], cksum 0xc4d6 (correct), seq 228, ack 229, win 124, options [nop,nop,TS val 2248411038 ecr 2592531231], length 0
06:36:21.977172 eth17 Out IP (tos 0xc0, ttl 1, id 33055, offset 0, flags [DF], proto TCP (6), length 52)
    10.0.0.32.bgp > 10.0.0.33.37011: Flags [.], cksum 0xc4d6 (correct), seq 228, ack 229, win 124, options [nop,nop,TS val 2248411038 ecr 2592531231], length 0
06:36:23.283262 Ethernet64 Out IP (tos 0xc0, ttl 1, id 33056, offset 0, flags [DF], proto TCP (6), length 71)
    10.0.0.32.bgp > 10.0.0.33.37011: Flags [P.], cksum 0xbb8e (correct), seq 228:247, ack 229, win 124, options [nop,nop,TS val 2248412344 ecr 2592531231], length 19: BGP
	Keepalive Message (4), length: 19
06:36:23.283361 eth17 Out IP (tos 0xc0, ttl 1, id 33056, offset 0, flags [DF], proto TCP (6), length 71)
    10.0.0.32.bgp > 10.0.0.33.37011: Flags [P.], cksum 0xbb8e (correct), seq 228:247, ack 229, win 124, options [nop,nop,TS val 2248412344 ecr 2592531231], length 19: BGP
	Keepalive Message (4), length: 19
06:36:23.284438 eth17 P   IP (tos 0xc0, ttl 1, id 30667, offset 0, flags [DF], proto TCP (6), length 52)
    10.0.0.33.37011 > 10.0.0.32.bgp: Flags [.], cksum 0xbb03 (correct), seq 229, ack 247, win 6, options [nop,nop,TS val 2592532539 ecr 2248412344], length 0
06:36:23.286174 Ethernet64 In  IP (tos 0xc0, ttl 1, id 30667, offset 0, flags [DF], proto TCP (6), length 52)
    10.0.0.33.37011 > 10.0.0.32.bgp: Flags [.], cksum 0xbb03 (correct), seq 229, ack 247, win 6, options [nop,nop,TS val 2592532539 ecr 2248412344], length 0
06:36:24.536837 Ethernet64 Out IP (tos 0xc0, ttl 1, id 33057, offset 0, flags [DF], proto TCP (6), length 75)
    10.0.0.32.bgp > 10.0.0.33.37011: Flags [P.], cksum 0xa765 (correct), seq 247:270, ack 229, win 124, options [nop,nop,TS val 2248413598 ecr 2592532539], length 23: BGP
	Notification Message (3), length: 23, Cease (6), subcode Unknown (9)
06:36:24.536940 eth17 Out IP (tos 0xc0, ttl 1, id 33057, offset 0, flags [DF], proto TCP (6), length 75)
    10.0.0.32.bgp > 10.0.0.33.37011: Flags [P.], cksum 0xa765 (correct), seq 247:270, ack 229, win 124, options [nop,nop,TS val 2248413598 ecr 2592532539], length 23: BGP
	Notification Message (3), length: 23, Cease (6), subcode Unknown (9)
06:36:24.538468 eth17 P   IP (tos 0xc0, ttl 1, id 30668, offset 0, flags [DF], proto TCP (6), length 52)
    10.0.0.33.37011 > 10.0.0.32.bgp: Flags [.], cksum 0xb120 (correct), seq 229, ack 270, win 6, options [nop,nop,TS val 2592533793 ecr 2248413598], length 0
06:36:24.539461 Ethernet64 In  IP (tos 0xc0, ttl 1, id 30668, offset 0, flags [DF], proto TCP (6), length 52)
    10.0.0.33.37011 > 10.0.0.32.bgp: Flags [.], cksum 0xb120 (correct), seq 229, ack 270, win 6, options [nop,nop,TS val 2592533793 ecr 2248413598], length 0
06:36:24.541839 Ethernet64 Out IP (tos 0xc0, ttl 1, id 33058, offset 0, flags [DF], proto TCP (6), length 52)
    10.0.0.32.bgp > 10.0.0.33.37011: Flags [F.], cksum 0xb0a4 (correct), seq 270, ack 229, win 124, options [nop,nop,TS val 2248413603 ecr 2592533793], length 0
06:36:24.541937 eth17 Out IP (tos 0xc0, ttl 1, id 33058, offset 0, flags [DF], proto TCP (6), length 52)
    10.0.0.32.bgp > 10.0.0.33.37011: Flags [F.], cksum 0xb0a4 (correct), seq 270, ack 229, win 124, options [nop,nop,TS val 2248413603 ecr 2592533793], length 0
06:36:24.542497 eth17 P   IP (tos 0xc0, ttl 1, id 30669, offset 0, flags [DF], proto TCP (6), length 52)
    10.0.0.33.37011 > 10.0.0.32.bgp: Flags [F.], cksum 0xb11a (correct), seq 229, ack 270, win 6, options [nop,nop,TS val 2592533798 ecr 2248413598], length 0
06:36:24.542498 eth17 P   IP (tos 0xc0, ttl 1, id 30670, offset 0, flags [DF], proto TCP (6), length 52)
    10.0.0.33.37011 > 10.0.0.32.bgp: Flags [.], cksum 0xb114 (correct), seq 230, ack 271, win 6, options [nop,nop,TS val 2592533798 ecr 2248413603], length 0
06:36:24.542621 Ethernet64 In  IP (tos 0xc0, ttl 1, id 30669, offset 0, flags [DF], proto TCP (6), length 52)
    10.0.0.33.37011 > 10.0.0.32.bgp: Flags [F.], cksum 0xb11a (correct), seq 229, ack 270, win 6, options [nop,nop,TS val 2592533798 ecr 2248413598], length 0
06:36:24.542672 Ethernet64 Out IP (tos 0xc0, ttl 1, id 33059, offset 0, flags [DF], proto TCP (6), length 52)
    10.0.0.32.bgp > 10.0.0.33.37011: Flags [.], cksum 0xb09d (correct), seq 271, ack 230, win 124, options [nop,nop,TS val 2248413604 ecr 2592533798], length 0
06:36:24.542645 Ethernet64 In  IP (tos 0xc0, ttl 1, id 30670, offset 0, flags [DF], proto TCP (6), length 52)
    10.0.0.33.37011 > 10.0.0.32.bgp: Flags [.], cksum 0xb114 (correct), seq 230, ack 271, win 6, options [nop,nop,TS val 2592533798 ecr 2248413603], length 0
06:36:24.542804 eth17 Out IP (tos 0xc0, ttl 1, id 33059, offset 0, flags [DF], proto TCP (6), length 52)
    10.0.0.32.bgp > 10.0.0.33.37011: Flags [.], cksum 0xb09d (correct), seq 271, ack 230, win 124, options [nop,nop,TS val 2248413604 ecr 2592533798], length 0
06:36:28.543217 eth17 P   IP (tos 0xc0, ttl 1, id 22363, offset 0, flags [DF], proto TCP (6), length 60)
    10.0.0.33.42927 > 10.0.0.32.bgp: Flags [S], cksum 0xf016 (correct), seq 1044294839, win 64218, options [mss 9174,sackOK,TS val 2592537798 ecr 0,nop,wscale 13], length 0
06:36:28.543397 Ethernet64 In  IP (tos 0xc0, ttl 1, id 22363, offset 0, flags [DF], proto TCP (6), length 60)
    10.0.0.33.42927 > 10.0.0.32.bgp: Flags [S], cksum 0xf016 (correct), seq 1044294839, win 64218, options [mss 9174,sackOK,TS val 2592537798 ecr 0,nop,wscale 13], length 0
06:36:28.543467 Ethernet64 Out IP (tos 0xc0, ttl 255, id 0, offset 0, flags [DF], proto TCP (6), length 60)
    10.0.0.32.bgp > 10.0.0.33.42927: Flags [S.], cksum 0x3eb0 (correct), seq 3632674158, ack 1044294840, win 63336, options [mss 9060,sackOK,TS val 2248417604 ecr 2592537798,nop,wscale 9], length 0
06:36:28.543548 eth17 Out IP (tos 0xc0, ttl 255, id 0, offset 0, flags [DF], proto TCP (6), length 60)
    10.0.0.32.bgp > 10.0.0.33.42927: Flags [S.], cksum 0x3eb0 (correct), seq 3632674158, ack 1044294840, win 63336, options [mss 9060,sackOK,TS val 2248417604 ecr 2592537798,nop,wscale 9], length 0
06:36:28.544160 eth17 P   IP (tos 0xc0, ttl 1, id 22364, offset 0, flags [DF], proto TCP (6), length 52)
    10.0.0.33.42927 > 10.0.0.32.bgp: Flags [.], cksum 0x828e (correct), seq 1, ack 1, win 8, options [nop,nop,TS val 2592537799 ecr 2248417604], length 0
06:36:28.544160 eth17 P   IP (tos 0xc0, ttl 1, id 22365, offset 0, flags [DF], proto TCP (6), length 111)
    10.0.0.33.42927 > 10.0.0.32.bgp: Flags [P.], cksum 0x123a (correct), seq 1:60, ack 1, win 8, options [nop,nop,TS val 2592537799 ecr 2248417604], length 59: BGP
	Open Message (1), length: 59
	  Version 4, my AS 64001, Holdtime 180s, ID 100.1.0.17
	  Optional parameters, length: 30
	    Option Capabilities Advertisement (2), length: 28
	      Multiprotocol Extensions (1), length: 4
		AFI IPv4 (1), SAFI Unicast (1)
		0x0000:  0001 0001
	      Route Refresh (2), length: 0
	      Graceful Restart (64), length: 6
		Restart Flags: [none], Restart Time 700s
		  AFI IPv4 (1), SAFI Unicast (1), Forwarding state preserved: no
		0x0000:  42bc 0001 0100
	      32-Bit AS Number (65), length: 4
		 4 Byte AS 64001
		0x0000:  0000 fa01
	      Multiple Paths (69), length: 4
		AFI IPv4 (1), SAFI Unicast (1), Send/Receive: Receive
		0x0000:  0001 0101
06:36:28.544293 Ethernet64 In  IP (tos 0xc0, ttl 1, id 22364, offset 0, flags [DF], proto TCP (6), length 52)
    10.0.0.33.42927 > 10.0.0.32.bgp: Flags [.], cksum 0x828e (correct), seq 1, ack 1, win 8, options [nop,nop,TS val 2592537799 ecr 2248417604], length 0
06:36:28.544362 Ethernet64 In  IP (tos 0xc0, ttl 1, id 22365, offset 0, flags [DF], proto TCP (6), length 111)
    10.0.0.33.42927 > 10.0.0.32.bgp: Flags [P.], cksum 0x123a (correct), seq 1:60, ack 1, win 8, options [nop,nop,TS val 2592537799 ecr 2248417604], length 59: BGP
	Open Message (1), length: 59
	  Version 4, my AS 64001, Holdtime 180s, ID 100.1.0.17
	  Optional parameters, length: 30
	    Option Capabilities Advertisement (2), length: 28
	      Multiprotocol Extensions (1), length: 4
		AFI IPv4 (1), SAFI Unicast (1)
		0x0000:  0001 0001
	      Route Refresh (2), length: 0
	      Graceful Restart (64), length: 6
		Restart Flags: [none], Restart Time 700s
		  AFI IPv4 (1), SAFI Unicast (1), Forwarding state preserved: no
		0x0000:  42bc 0001 0100
	      32-Bit AS Number (65), length: 4
		 4 Byte AS 64001
		0x0000:  0000 fa01
	      Multiple Paths (69), length: 4
		AFI IPv4 (1), SAFI Unicast (1), Send/Receive: Receive
		0x0000:  0001 0101
06:36:28.544378 Ethernet64 Out IP (tos 0xc0, ttl 255, id 47873, offset 0, flags [DF], proto TCP (6), length 52)
    10.0.0.32.bgp > 10.0.0.33.42927: Flags [.], cksum 0x81de (correct), seq 1, ack 60, win 124, options [nop,nop,TS val 2248417605 ecr 2592537799], length 0
06:36:28.544400 eth17 Out IP (tos 0xc0, ttl 255, id 47873, offset 0, flags [DF], proto TCP (6), length 52)
    10.0.0.32.bgp > 10.0.0.33.42927: Flags [.], cksum 0x81de (correct), seq 1, ack 60, win 124, options [nop,nop,TS val 2248417605 ecr 2592537799], length 0
06:36:28.544469 Ethernet64 Out IP (tos 0xc0, ttl 255, id 47874, offset 0, flags [DF], proto TCP (6), length 52)
    10.0.0.32.bgp > 10.0.0.33.42927: Flags [R.], cksum 0x81da (correct), seq 1, ack 60, win 124, options [nop,nop,TS val 2248417605 ecr 2592537799], length 0
06:36:28.545000 eth17 Out IP (tos 0xc0, ttl 255, id 47874, offset 0, flags [DF], proto TCP (6), length 52)
    10.0.0.32.bgp > 10.0.0.33.42927: Flags [R.], cksum 0x81da (correct), seq 1, ack 60, win 124, options [nop,nop,TS val 2248417605 ecr 2592537799], length 0
06:36:34.546406 eth17 P   IP (tos 0xc0, ttl 1, id 23095, offset 0, flags [DF], proto TCP (6), length 60)
    10.0.0.33.41699 > 10.0.0.32.bgp: Flags [S], cksum 0x3eed (correct), seq 2185299767, win 64218, options [mss 9174,sackOK,TS val 2592543801 ecr 0,nop,wscale 13], length 0
06:36:34.546999 Ethernet64 In  IP (tos 0xc0, ttl 1, id 23095, offset 0, flags [DF], proto TCP (6), length 60)
    10.0.0.33.41699 > 10.0.0.32.bgp: Flags [S], cksum 0x3eed (correct), seq 2185299767, win 64218, options [mss 9174,sackOK,TS val 2592543801 ecr 0,nop,wscale 13], length 0
06:36:34.547089 Ethernet64 Out IP (tos 0xc0, ttl 255, id 0, offset 0, flags [DF], proto TCP (6), length 60)
    10.0.0.32.bgp > 10.0.0.33.41699: Flags [S.], cksum 0xb0ae (correct), seq 1502771654, ack 2185299768, win 63336, options [mss 9060,sackOK,TS val 2248423608 ecr 2592543801,nop,wscale 9], length 0
06:36:34.547201 eth17 Out IP (tos 0xc0, ttl 255, id 0, offset 0, flags [DF], proto TCP (6), length 60)
    10.0.0.32.bgp > 10.0.0.33.41699: Flags [S.], cksum 0xb0ae (correct), seq 1502771654, ack 2185299768, win 63336, options [mss 9060,sackOK,TS val 2248423608 ecr 2592543801,nop,wscale 9], length 0
06:36:34.547720 eth17 P   IP (tos 0xc0, ttl 1, id 23096, offset 0, flags [DF], proto TCP (6), length 52)
    10.0.0.33.41699 > 10.0.0.32.bgp: Flags [.], cksum 0xf48b (correct), seq 1, ack 1, win 8, options [nop,nop,TS val 2592543803 ecr 2248423608], length 0
06:36:34.547720 eth17 P   IP (tos 0xc0, ttl 1, id 23097, offset 0, flags [DF], proto TCP (6), length 111)
    10.0.0.33.41699 > 10.0.0.32.bgp: Flags [P.], cksum 0x8437 (correct), seq 1:60, ack 1, win 8, options [nop,nop,TS val 2592543803 ecr 2248423608], length 59: BGP
	Open Message (1), length: 59
	  Version 4, my AS 64001, Holdtime 180s, ID 100.1.0.17
	  Optional parameters, length: 30
	    Option Capabilities Advertisement (2), length: 28
	      Multiprotocol Extensions (1), length: 4
		AFI IPv4 (1), SAFI Unicast (1)
		0x0000:  0001 0001
	      Route Refresh (2), length: 0
	      Graceful Restart (64), length: 6
		Restart Flags: [none], Restart Time 700s
		  AFI IPv4 (1), SAFI Unicast (1), Forwarding state preserved: no
		0x0000:  42bc 0001 0100
	      32-Bit AS Number (65), length: 4
		 4 Byte AS 64001
		0x0000:  0000 fa01
	      Multiple Paths (69), length: 4
		AFI IPv4 (1), SAFI Unicast (1), Send/Receive: Receive
		0x0000:  0001 0101
06:36:34.547792 Ethernet64 In  IP (tos 0xc0, ttl 1, id 23096, offset 0, flags [DF], proto TCP (6), length 52)
    10.0.0.33.41699 > 10.0.0.32.bgp: Flags [.], cksum 0xf48b (correct), seq 1, ack 1, win 8, options [nop,nop,TS val 2592543803 ecr 2248423608], length 0
06:36:34.547826 Ethernet64 In  IP (tos 0xc0, ttl 1, id 23097, offset 0, flags [DF], proto TCP (6), length 111)
    10.0.0.33.41699 > 10.0.0.32.bgp: Flags [P.], cksum 0x8437 (correct), seq 1:60, ack 1, win 8, options [nop,nop,TS val 2592543803 ecr 2248423608], length 59: BGP
	Open Message (1), length: 59
	  Version 4, my AS 64001, Holdtime 180s, ID 100.1.0.17
	  Optional parameters, length: 30
	    Option Capabilities Advertisement (2), length: 28
